id,scode,sname,hospital_id,hospital_name
914,32,Kerala,91320177,GOVT AYURVEDA DISPENSARY CHOKKAD
915,32,Kerala,91320197,Government ayurveda dispensary Tirurangadi
916,32,Kerala,91320183,"GOVT AYURVEDA DISPENSARY ,MELATTUR"
917,32,Kerala,91320174,GOVERNMENT AYURVEDA DISPENSARY KOLATHUR
918,32,Kerala,91320164,"Government Ayurveda Dispensary,Karuvarakundu"
919,32,Kerala,91320152,GOVT AYURVEDA DISPENSARY KOTTAKKAL
920,32,Kerala,91320167,GovernmentAyurveda Dispensary Paramba
921,32,Kerala,91320166,G.A.D VETTINAD
922,32,Kerala,17023,Gov.Ayur.Hosp.Mattanchery
923,32,Kerala,17020,GAD Aikkaranad
924,32,Kerala,17027,GAD Veliyathunadu
925,32,Kerala,17030,"GOVT.AYURVEDA HOSPITAL ,AYOOR"
926,32,Kerala,91320518,"GOVERNMENT AYURVEDA DISPENSARY, ANCHAL"
927,32,Kerala,91320517,"GOVERNMENT AYURVEDA DISPENSARY, ADICHANALLOOR"
928,32,Kerala,91320200,GAD ANDOORKONAM 
929,32,Kerala,91320219,GOVT AYURVEDA DISPENSARY CHALIAPURAM
930,32,Kerala,17031,Govt Ayurveda Hospital Paravoor
931,32,Kerala,17011,"Dist.Ayurveda Hosp.Kozhikode
"
932,32,Kerala,17008,Govt Ayur Disp Chadayamangalam
933,32,Kerala,17018,Govt.Ayurveda Disp.Secretariat
934,32,Kerala,17019,GAH Pallippuram
935,32,Kerala,17021,GAD Udayamperoor
936,32,Kerala,17022,GAD Ezhakkaranad
937,32,Kerala,17029,GAD Thrikkakara
938,32,Kerala,17028,GAH Vatakara
939,32,Kerala,17007,Dist.Ayurveda Hosp.Kannur
940,32,Kerala,17024,GOVT AYURVEDA HOSPITAL  NORTH PARAVUR
941,32,Kerala,91320250,GOVT.AYURVEDA HOSPITAL PONNANI
942,32,Kerala,37276,Govt Ayurveda Dispensary Kavalangadu
943,32,Kerala,37321,Govt Ayurveda Dispensary Kavana
944,32,Kerala,37329,GOVT AYURVEDA DISPENSARY KODIKULAM
945,32,Kerala,37267,Govt Ayurveda Dispensary Kottappady
946,32,Kerala,37323,Govt Ayurveda Dispensary Kottuvally
947,32,Kerala,1093,Govt Ayurveda Dispensary Kumarakom
948,32,Kerala,37206,Govt Ayurveda Dispensary Kumbalam
949,32,Kerala,37261,Govt Ayurveda Dispensary Kunnukara
950,32,Kerala,37250,Govt Ayurveda Dispensary Kuttampuzha
951,32,Kerala,37235,GOVT AYURVEDA DISPENSARY KUZHALMANNAM
952,32,Kerala,37268,Govt Ayurveda Dispensary Mamalakkandam
953,32,Kerala,37327,Govt Ayurveda Dispensary Mathur
954,32,Kerala,99900476,"GOVT AYURVEDA DISPENSARY, NEDUNGOTTUR"
955,32,Kerala,37312,Govt Ayurveda Dispensary Okkal
956,32,Kerala,37315,Govt Ayurveda Dispensary Onakkoor South
957,32,Kerala,99900792,Govt Ayurveda Dispensary Oorakam
958,32,Kerala,17035,GOVT AYURVEDA DISPENSARY PALLICKAL
959,32,Kerala,37208,Govt Ayurveda Dispensary Pallikunnu
960,32,Kerala,99900784,Govt Ayurveda Dispensary Peruvampadam
961,32,Kerala,99900639,Govt Ayurveda Dispensary Pilicode
962,32,Kerala,99900798,Govt Ayurveda Dispensary Ponmala
963,32,Kerala,99900746,Govt Ayurveda Dispensary Poothakulam
964,32,Kerala,37273,Govt Ayurveda dispensary Pothanikkad
965,32,Kerala,99900543,GOVT AYURVEDA DISPENSARY PRAMADAM
966,32,Kerala,37305,GOVT AYURVEDA DISPENSARY PUDUPARIYARAM
967,32,Kerala,37274,Govt Ayurveda Dispensary Pulluvazhi
968,32,Kerala,37298,GOVT AYURVEDA DISPENSARY PUTHUCODE
969,32,Kerala,99900538,GOVT AYURVEDA DISPENSARY RANNI SOUTH
970,32,Kerala,37244,Govt Ayurveda Dispensary Thaikkattukara
971,32,Kerala,99900789,Govt Ayurveda Dispensary Thennala
972,32,Kerala,99900477,GOVT AYURVEDA DISPENSARY THIRUMITTACODE
973,32,Kerala,37279,Govt Ayurveda Dispensary  Thuruthikkara
974,32,Kerala,2091,Govt Ayurveda Dispensary Vadasserikkara
975,32,Kerala,99900808,Govt Ayurveda Dispensary Valluvambram
976,32,Kerala,37280,Govt Ayurveda Dispensary Vavakkad
977,32,Kerala,37326,Govt Ayurveda Dispensary Vazhakulam South
978,32,Kerala,99900536,GOVT AYURVEDA DISPENSARY VECHOOCHIRA
979,32,Kerala,99900649,Govt Ayurveda Dispensary Veeyapuram
980,32,Kerala,99900681,Govt Ayurveda Dispensary Vellarada
981,32,Kerala,943,Govt Ayurveda Dispensary Venmony
982,32,Kerala,99900575,Govt. Ayurveda Dispersary Cheramaanthuruth
983,32,Kerala,99900644,Govt Ayurveda Hospital Angadickal North
984,32,Kerala,941,Govt Ayurveda Hospital Aroor
985,32,Kerala,1022,Govt Ayurveda Hospital Ayoor
986,32,Kerala,37304,GOVT AYURVEDA HOSPITAL CHALAVARA
987,32,Kerala,1030,Govt Ayurveda Hospital Chelakkara
988,32,Kerala,939,Govt Ayurveda Hospital Cherthala
989,32,Kerala,956,Govt Ayurveda Hospital Edakkara
990,32,Kerala,1032,GOVT AYURVEDA HOSPITAL IRINAVU
991,32,Kerala,961,Govt Ayurveda Hospital Kallar
992,32,Kerala,99900780,Govt Ayurveda Hospital Kottoor
993,32,Kerala,99900723,Govt Ayurveda Hospital Manjeri
994,32,Kerala,37278,Govt Ayurveda Hospital Mannathoor
995,32,Kerala,99900814,Govt Ayurveda Hospital Mavelikkara
996,32,Kerala,1023,GOVT AYURVEDA HOSPITAL MEENADOM
997,32,Kerala,99900579,Govt Ayurveda Hospital Muvattupuzha
998,32,Kerala,99900539,GOVT AYURVEDA HOSPITAL NATTAKOM
999,32,Kerala,99900576,GOVT AYURVEDA HOSPITAL NEDUMANGAD
1000,32,Kerala,1021,GOVT AYURVEDA HOSPITAL NELLIPPARA ALAKODE
1001,32,Kerala,1338,Govt Ayurveda Hospital Nochad
1002,32,Kerala,99900578,GOVT AYURVEDA HOSPITAL PALA
1003,32,Kerala,37301,Govt Ayurveda Hospital Palakuzha
1004,32,Kerala,1092,Govt Ayurveda Hospital Piravom
1005,32,Kerala,1083,Govt Ayurveda Hospital Tarur
1006,32,Kerala,1024,Govt Ayurveda Hospital Thalassery
1007,32,Kerala,1089,Govt Ayurveda Hospital Thathamanagalam
1008,32,Kerala,1090,Govt Ayurveda Hospital Vaikom
1009,32,Kerala,1026,Govt Ayurveda Hospital Veliyannoor
1010,32,Kerala,962,Govt Ayurveda Panchakarma Hospital Alappuzha
1011,32,Kerala,37199,Govt Ayurveda Tribal Dispensary Naranammoozhi
1012,32,Kerala,37258,Govt Ayurveda Tribal Dispensary Pinavoorkudy
1013,32,Kerala,37198,Govt Ayurveda Visha Vaidya Dispensary Maradu
1014,32,Kerala,17003,GOVT DISTRICT AYURVEDA HOSPITAL VARKALA
1015,32,Kerala,37307,GOVT MODEL AYURVEDA DISPENSARY MUNDUR
1016,32,Kerala,99900664,Govt Taluk Ayurveda Hospital Sulthan Bathery
1017,32,Kerala,17017,GOVT UNANI DISPENSARY MOGRAL
1018,32,Kerala,99900748,KOLLAM CORPORATION GOVT AYURVEDA DISPENSARY VADAKKEVILA
1019,32,Kerala,37241,Payyoli Municipality Taluk Ayurveda Hospital
1020,32,Kerala,99900633,PERINTHALMANNA MUNICIPALITY GOVT AYURVEDA HOSPITAL PERINTHALMANNA
1021,32,Kerala,17025,RAMAVARMA DISTRICT AYURVEDA HOSPITAL THRISSUR
1022,32,Kerala,1035,V K Sm M Govt.ayurveda Hospital Santhipuram
1023,32,Kerala,17009,DISTRICT AYURVEDA HOSPITAL KOLLAM
1024,37,Ladakh,37001,District Hospital Kargil
1025,37,Ladakh,16001,Sonam Nurboo Memorial Hospital
1026,31,Lakshadweep,19002,Indira Gandhi Hospital Kavaratti
1027,31,Lakshadweep,1100,Community Health Centre Amini
1028,23,Madhya Pradesh,23045,District Hospital Khargone
1029,23,Madhya Pradesh,23009,District Hospital Barwani
1030,23,Madhya Pradesh,23042,Community Health Center Budni District Sehore
1031,23,Madhya Pradesh,91233201,D.P.Cantt General Hospital Mhow
1032,23,Madhya Pradesh,23026,sardar vallabhbhai patel district hospital satna
1033,23,Madhya Pradesh,91233194,Gorabazar Dispensary
1034,23,Madhya Pradesh,91233193,Motilal Nehru Hospital
1035,23,Madhya Pradesh,23049,district bhoj hospital dhar
1036,23,Madhya Pradesh,23058,District Hospital Sidhi
1037,23,Madhya Pradesh,23063,District Hospital Vidisha
1038,23,Madhya Pradesh,23020,District hospital damoh
1039,23,Madhya Pradesh,23008,"District Hospital Morar , Gwalior"
1040,23,Madhya Pradesh,23060,DISTRICT HOSPITAL DINDORI
1041,23,Madhya Pradesh,23050,District Hospital Umaria
1042,23,Madhya Pradesh,23054,CIVIL HOSPITAL MAIHAR
1043,23,Madhya Pradesh,983,Composite Hospital Crpf Bhopal
1044,23,Madhya Pradesh,23059,District Hospital Sagar
1045,23,Madhya Pradesh,1233,Composite Hospital Crpf Neemuch
1046,23,Madhya Pradesh,23068,District Hospital Harda
1047,23,Madhya Pradesh,23034,District hospital Rajgarh
1048,23,Madhya Pradesh,23025,"CHC, NASRULLAGANJ, SEHORE"
1049,23,Madhya Pradesh,1197,Civil Hospital Hazira
1050,23,Madhya Pradesh,23053,J.P Hospital district bhopal
1051,23,Madhya Pradesh,23006,Bundelkhand Medical College Sagar
1052,23,Madhya Pradesh,23064,shaheed bhagat singh district hospital balaghat
1053,23,Madhya Pradesh,23035,Distrcit Hospital Ujjain
1054,23,Madhya Pradesh,23043,Community Health Center Shyampur District Sehore
1055,23,Madhya Pradesh,23044,District hospital Khandwa
1056,23,Madhya Pradesh,23067,District Hospital Chhatarpur
1057,23,Madhya Pradesh,23056,District hodpital Burhanpur
1058,23,Madhya Pradesh,23033,district hospital sehore
1059,23,Madhya Pradesh,23065,District Hospital Datia
1060,23,Madhya Pradesh,23066,Vijyaraje sindhiya Distrcit Hospital Neemuch
1061,23,Madhya Pradesh,23057,District Hospital Jhabua
1062,23,Madhya Pradesh,23062,District Hospital Singrauli
1063,23,Madhya Pradesh,23030,District Hospital Sheopur
1064,23,Madhya Pradesh,23048,District Hospital Ratlam
1065,23,Madhya Pradesh,23051,District Hospital Narsinghpur
1066,23,Madhya Pradesh,23017,district hospital betul
1067,23,Madhya Pradesh,23028,District Hospital Panna
1068,23,Madhya Pradesh,23023,District Hospital Morena
1069,23,Madhya Pradesh,23047,District Hospital Indore
1070,23,Madhya Pradesh,23012,mahatma gandhi jila chikitsalay dewas
1071,23,Madhya Pradesh,23007,District Hospital Katni
1072,23,Madhya Pradesh,23061,Indra Gandhi Distrcit Hospital Mandsaur
1073,23,Madhya Pradesh,23041,Distrcit Hospital Anuppur
1074,23,Madhya Pradesh,23010,"M.G.M. Medical College and associated Hospitals, Indore"
1075,23,Madhya Pradesh,23013,"District Hospital Bhind,M.P."
1076,23,Madhya Pradesh,23027,District Hospital Guna
1077,23,Madhya Pradesh,23005,Netaji Subhash Chandra Bose Medical college Jabalpur
1078,23,Madhya Pradesh,91233205,Cantonment Board Pachmarhi Dispensary
1079,23,Madhya Pradesh,23021,Dr. Rajendra prasad Hospital Tikamgarh
1080,23,Madhya Pradesh,23029,Seth Govind Das Distrcit Hospital Jabalpur
1081,23,Madhya Pradesh,23046,Bhimrao Ambedkar District Hospital Shajapur
1082,23,Madhya Pradesh,23032,Distrcit Hospital Narmadapuram
1083,23,Madhya Pradesh,23036,shri kushabhau thakre district hospital shahdol
1084,23,Madhya Pradesh,23024,District Hospital Shivpuri
1085,23,Madhya Pradesh,23018,Distrcit Hospital chhindwara
1086,23,Madhya Pradesh,23031,Distrcit hospital raisen
1087,23,Madhya Pradesh,91233195,Cantt General Hospital Saugro
1088,23,Madhya Pradesh,23015,District Hospital Alirajpur
1089,23,Madhya Pradesh,23022,District Hospital Ashoknagar
1090,23,Madhya Pradesh,91233196,"Cantonment General Hospital, Morar Cantt"
1091,27,Maharashtra,91270248,"Primary Health Centre , Kangaon"
1092,27,Maharashtra,1056,Sri Bhausaheb Hire Government Medical College And Sarvopchar Rugnalay Dhule
1093,27,Maharashtra,1054,Shri Vasantrao Naik Government Medical College And Hospital Yavatmal
1094,27,Maharashtra,1157,Padmabhushan Vasantdada Patil Government Hospital Sangli
1095,27,Maharashtra,950,Shri Sainath Hospital 
1096,27,Maharashtra,1139,Rural Health Trainning Centre Shirur Pune
1097,27,Maharashtra,1155,M A Podar Ayurved Hospital
1098,27,Maharashtra,1042,Government Medical College And Superspeciality Hospital Nagpur
1099,27,Maharashtra,1117,Government Medical College And Hospital Baramati
1100,27,Maharashtra,1080,Government Homeopathy Hospital
1101,27,Maharashtra,1081,Government Ayurved Hospital Jalgaon
1102,27,Maharashtra,1039,Government Ayurved College And Hospital Nanded
1103,27,Maharashtra,1052,Government  Ayurved College and Hospital
1104,27,Maharashtra,1147,Goverment Dental College
1105,27,Maharashtra,1037,Gokuldas Tejpal Hospital Mumbai
1106,27,Maharashtra,91270006,"Kasturba Hospital,Sevagram,Wardha, Maharashtra"
1107,27,Maharashtra,91270206,MARKET DISPENSARY
1108,27,Maharashtra,91270002,"PHC Valsang, Maharashtra"
1109,27,Maharashtra,91270037,ALI YAVAR JUNG NATIONAL INSTITUTE OF SPEECH AND HEARING DISABILITIES  DIVYANGJAN 
1110,27,Maharashtra,91270198,Aurangabad Cantonment General Hospital
1111,27,Maharashtra,91270195,Cantonment General Hospital Kamptee
1112,27,Maharashtra,91270190,Cantonment General Hopsital Devlali
1113,27,Maharashtra,91270196,"Dr. Babasaheb Ambedkar Cantonment General Hospital,Dehuroad"
1114,27,Maharashtra,91270202,Dr Babasaheb Ambedkar Cantonment General Hospital
1115,27,Maharashtra,91270192,Sardar Vallabhbhai Patel Cantonment General Hospital Pune
1116,27,Maharashtra,91270189,"All India Institute of Medical Sciences, Nagpur"
1117,27,Maharashtra,91270227,Primary health center Rohana
1118,27,Maharashtra,91270279,PHC POHANA
1119,27,Maharashtra,91270262,Police Hospital
1120,27,Maharashtra,1137,Government Medical College And Hospital Sindhudurg
1121,27,Maharashtra,1048,Directorate Of Medical Education And Research
1122,27,Maharashtra,1161,Government Ayurved College And Hospital Dharashiv
1123,27,Maharashtra,1051,Government Ayurved College Baramati
1124,27,Maharashtra,1121,Government Dental College and  Hospital
1125,27,Maharashtra,1120,Government Homoeopathy College And Hospital Jalgaon
1126,27,Maharashtra,1058,Dr Vaishyampayan  Memorial Medical College And Shri Ch Shivaji Maharaj Sarvopchar Rugnalaya Solapur
1127,27,Maharashtra,1038,Government Medical College And Hospital Miraj
1128,27,Maharashtra,1148,Rural Health Training Center Paithan
1129,27,Maharashtra,1118,Dr Shankarrao Chavan Government Medical College Nanded
1130,27,Maharashtra,1097,Crpf Composite Hospital
1131,27,Maharashtra,1050,Cama And Albless Hospital
1132,27,Maharashtra,1053,B. J. Govt Medical College and Sasoon General Hospital
1133,27,Maharashtra,21003,All India Institute of Physical Medicine and Rehabilitation
1134,27,Maharashtra,1115,Swami Ramanad  Teerth Rural Government Medical College And Hospital Ambajogai
1135,27,Maharashtra,1095,Indira Gandhi Government Medical College And Hospital
1136,27,Maharashtra,210,Grant Government Medical College And Sir Jj Group Of Hospital Mumbai
1137,27,Maharashtra,1145,Government Medical College Chandrapur
1138,27,Maharashtra,1125,Chhatrapati Sambhaji Maharaj Government Medical College and Hospital Satara
1139,27,Maharashtra,1162,Vilasrao Deshmukh Goverment Medical Colleage And Superspeciality Hospital Latur
1140,27,Maharashtra,1163,Government Medical College and Superspeciality Hospital
1141,27,Maharashtra,91270254,Rural Hospital Karanja  Gh 
1142,27,Maharashtra,91270256,"PRIMARY HEALTH CENTER,NACHANGAON"
1143,27,Maharashtra,91270258,Urban Primary Health
1144,27,Maharashtra,1114,Government Medical College And Hospital Jalgaon
1145,27,Maharashtra,91270272,Primary Health center Waifad
1146,27,Maharashtra,91270217,Rural Hospital Ashti 
1147,27,Maharashtra,91270263,Railway Hospital
1148,27,Maharashtra,91270226,Primary Health Centre Vijaygopal
1149,27,Maharashtra,91270253,Primary Health Center Talegaon T 
1150,27,Maharashtra,91270201,"Dr. B. R. Ambedkar Cantonment Hospital,Ahmednagar"
1151,27,Maharashtra,91270246,PHC SINDHI RAILWAY
1152,27,Maharashtra,91270239,"Primary health center, sarwadi"
1153,27,Maharashtra,91270260,Primary Health Center Sahur
1154,27,Maharashtra,91270243,"Primary Health Centre ,Nandori"
1155,27,Maharashtra,91270264,Civil Hospital Vaccination Centre
1156,27,Maharashtra,91270236,Primary Health Center Hamdapur
1157,27,Maharashtra,91270265,Gandhi Memorial Leprosy Foundation
1158,27,Maharashtra,21001,"NMMC General Hospital, Vashi, Maharashtra"
1159,27,Maharashtra,91270229,Primary Health Center Burkoni
1160,27,Maharashtra,91270244,PRIMARY HEALTH CENTER KHARANGANA MORANGANA 
1161,27,Maharashtra,91270245,"Primary Health Centre, Muradgaon  B "
1162,27,Maharashtra,91270221,primary health centre antora
1163,27,Maharashtra,91270209,Command Hospital  SC  Pune
1164,27,Maharashtra,91270136,District Women Hospital Akola
1165,27,Maharashtra,91270152,B. J. GOVT MEDICAL COLLEGE   SASSOON GENERAL HOSPITALS PUNE
1166,27,Maharashtra,1130,Rajarshee Chhatrapati Shahu Maharaj Government Medical College and Chhatrapati Pramilatai Raje Hospital
1167,27,Maharashtra,1112,"Government Medical College and Hospital, Nandurbar"
1168,27,Maharashtra,1127,Government Medical College And Hospital Dharashiv
1169,27,Maharashtra,1116,Government Medical College and Hospital
1170,27,Maharashtra,91270210,INHS Asvini
1171,27,Maharashtra,91270231,Primary Health Centre Girad
1172,27,Maharashtra,1129,Health Unit Palghar
1173,27,Maharashtra,1096,Composite Hospital Crpf Nagpur
1174,27,Maharashtra,1057,Urban Health Centre Bandra
1175,14,Manipur,22001,Regional Institute of Medical Sciences
1176,14,Manipur,405,Chc Kangpokpi
1177,17,Meghalaya,91170015,Jeevan Ram Goenka Cantonment General Hospital
1178,17,Meghalaya,1107,Meghalaya Institute of Mental Health and Neurological Science
1179,17,Meghalaya,99901070,100 Bedded Mch Hospital Jowai
1180,17,Meghalaya,20005,Tura Civil Hospital
1181,17,Meghalaya,20004,civil hospital shillong
1182,17,Meghalaya,1045,Capfs Composite Bsf Shillong
1183,17,Meghalaya,2010,Tirot Sing Memorial Civil Hospital
1184,17,Meghalaya,91170005,"NEIGRIHMS, Shillong, Meghalaya"
1185,17,Meghalaya,20002,NORTH EASTERN INDIRA GANDHI REGIONAL INSTITUTE OF HEALTH AND MEDICAL SCIENCES
1186,15,Mizoram,973,Zoram Medical College and Hospital Falkawn
1187,15,Mizoram,1206,Capfs Composite Hospital Bsf Aizawl
1188,13,Nagaland,1059,Assam Rifles Composite Hospital
1189,13,Nagaland,99901118,District Hospital Tuensang Nagaland
1190,21,Odisha,91210009,"S.V.P Post Graduate Institute Of Pediatrics, Cuttack, Odisha"
1191,21,Odisha,26002,Swami Vivekanand National Institute of Rehabilitation Training and Research
1192,21,Odisha,91210005,"AIIMS, Bhubaneswar, Odisha"
1193,21,Odisha,91210006,"Acharya Harihar Regional Cancer Centre, Cuttack, Odisha"
1194,21,Odisha,1234,Composite Hospital Crpf Nayapalli
1195,34,Puducherry,91340005,"Govt General Hospital, Yanam"
1196,34,Puducherry,91340020,"COMMUNITY HEALTH CENTRE, PALLOOR"
1197,34,Puducherry,27004,INDIRA GANDHI GOVERNMENT GENERAL HOSPITAL AND POST GRADUATE INSTITUTE
1198,34,Puducherry,27005,RAJIV GANDHI GOVERNMENT WOMEN AND CHILDREN HOSPITAL
1199,34,Puducherry,27006,Indira Gandhi Medical College and Research Institute
1200,3,Punjab,275,Guru Nanak Dev Hospital Complex
1201,3,Punjab,1213,Composite Hospital Bsf Jalandhar
1202,3,Punjab,211,Government Medical College and Rajindra Hospital
1203,3,Punjab,363,"Guru Gobind Singh Medical College Hospital, Faridkot (Punjab)"
1204,3,Punjab,946,Dr Br Ambedkar State Institute Of Medical Sciences
1205,3,Punjab,91030049,Government Medical College and Rajindera Hospital 
1206,3,Punjab,91030026,War Memorial XXIX Punjabis Cantonment General Hospital
1207,3,Punjab,91030024,"Cantonment General Hospital, Cantonment Board Ferozepur"
1208,3,Punjab,66,Demo HospitAL
1209,3,Punjab,91030025,Cantonment Board Dispensary Amritsar Cantt
1210,3,Punjab,91030019,AIIMS Bathinda
1211,8,Rajasthan,10004,DEMO ORS G
1212,8,Rajasthan,91080062,Cantonment Board Ajmer Dispensary
1213,8,Rajasthan,91080006,"National Institute of Ayurveda Hospital, Jaipur, Rajasthan"
1214,8,Rajasthan,1036,COMPOSITE HOSPITAL BSF JODHPUR
1215,8,Rajasthan,1215,Composite Hospital Crpf Ajmer
1216,33,Tamil Nadu,91330038,Shri. Gulabchand Jain Cantonment Dispensary Pallavaram
1217,33,Tamil Nadu,91330039,"Cantonment Dispensary Cum Maternity Centre, St. Thomas Mount"
1218,33,Tamil Nadu,1200,Composite Hospital Crpf
1219,33,Tamil Nadu,91330035,"Cantonment General Hospital, Wellington"
1220,36,Telangana,36001,"Government General Hospital, Nizamabad, Telangana"
1221,36,Telangana,36002,Gov.Area Hospital Narayanpet
1222,36,Telangana,36004,KOSGI CIVIL HOSPITAL
1223,36,Telangana,91360054,"Sardar Vallabhbhai Patel Cantonment General Hospital Bolaram, Secunderabad"
1224,36,Telangana,1218,Ch Crpf Hyd
1225,36,Telangana,36006,"Gov.General Hospital,Mahabubnagar,Telangana"
1226,36,Telangana,36003,CHC BADEPALLY
1227,36,Telangana,91360057,"CANTONMENT DISPENSARY, BALAMRAI."
1228,36,Telangana,91360001,DEMO ORS STANDALONE
1229,36,Telangana,91360056,"CANTONMENT DISPENSARY, PICKET"
1230,36,Telangana,36008,AREA HOSPITAL NIRMAL
1231,36,Telangana,91360055,CANTONMENT DISPENSARY TRIMULGHERYY 
1232,16,Tripura,32033,Gandacherra SDH
1233,16,Tripura,32034,Bimal Sinha Memorial Subdivisional Hospital
1234,16,Tripura,91162042,Tripura Medical College & Dr. BRAM Teaching Hospital
1235,16,Tripura,32038,Longtharai Vallley Sub Divisional Hospital
1236,16,Tripura,32019,Gomati District Hospital
1237,16,Tripura,32022,Melaghar S D Hospital
1238,16,Tripura,32020,Tripura Sundari Sub Divisional Hospital
1239,16,Tripura,32032,Belonia SDH
1240,16,Tripura,32036,Kanchanpur Sub Divisional Hospital
1241,16,Tripura,32037,Rajib Gandhi Memorial Sub Divisional Hospital
1242,16,Tripura,32030,Dhalai District Hospital
1243,16,Tripura,32021,Indira Gandhi Memorial Hospital
1244,16,Tripura,32024,Khowai District Hospital
1245,16,Tripura,32029,District Hospital North Tripura Dharmanagar
1246,16,Tripura,32018,AMARPUR SUB DIVISIONAL HOSPITAL
1247,16,Tripura,32027,District Hospital South Tripura Santirbazar
1248,16,Tripura,32028,UNAKOTI DISTRICT HOSPITAL
1249,16,Tripura,32031,Bishalghar Sub Divisional Hospital
1250,16,Tripura,32035,Sabroom Sub Divisional Hospital
1251,16,Tripura,91160006,Regional Cancer Center Agartala Tripura
1252,16,Tripura,2048,Gachirampara Primary Health Centre
1253,16,Tripura,1,AGMC & Gobind Ballav Pant Hospital
1254,5,Uttarakhand,91050016,"LD Bhatt Govt. Hospital, Kashipur, Udham Singh Nagar"
1255,5,Uttarakhand,91050070,"CHC, Jaspur, Udham Singh Nagar"
1256,5,Uttarakhand,91050028,"District Hospital, Rudraprayag"
1257,5,Uttarakhand,91050160,Cantonment General Hospital Lansdowne
1258,5,Uttarakhand,91050059,"Govt. Combined Hospital, Kotdwar, Pauri Garhwal"
1259,5,Uttarakhand,91050049,"Sri Dev Suman Combined Hospital, Narendernagar, Tehri Garhwal"
1260,5,Uttarakhand,91050044,"B D Pandey Female Hospital, Nainital"
1261,5,Uttarakhand,91050154,Pandit Madan Mohan Upadhyay Cantt Dispensary Ranikhet
1262,5,Uttarakhand,91050021,"Combined Hospital, Tanakpur, Champawat"
1263,5,Uttarakhand,1245,Jnsm Government Hospital
1264,5,Uttarakhand,91050056,"Soban Singh Jeena Base Hospital, Haldwani, Nainital"
1265,5,Uttarakhand,91050027,"Government Mela Hospital, Haridwar"
1266,5,Uttarakhand,91050048,"District Hospital, Baurari, Tehri garhwal"
1267,5,Uttarakhand,33007,"Govt. Doon Medical College Hospital, Dehradun"
1268,5,Uttarakhand,91050068,"CHC, Sitarganjngh, Udham Singh Nagar"
1269,5,Uttarakhand,91050069,"CHC, Khatima, Udham Singh Nagar"
1270,5,Uttarakhand,91050013,"Jawahar Lal Nehru District Hospital, Rudrapur, Udham Singh Nagar"
1271,5,Uttarakhand,91050046,"Shyam Lal Sah District Hospital, Bageshwar"
1272,5,Uttarakhand,91050050,"Combined Hospital, Premnagar, Dehradun"
1273,5,Uttarakhand,91050018,"H.M.G District Hospital, Haridwar"
1274,5,Uttarakhand,91050067,"S B B Patel CHC, Kichha, Udham Singh Nagar"
1275,5,Uttarakhand,91050040,"M S Mehta CHC Baijnath, Bageshwar"
1276,5,Uttarakhand,91050038,"B D Pandey District Hospital, Pithoragarh"
1277,5,Uttarakhand,91050025,"District Hospital, Uttarkashi"
1278,5,Uttarakhand,91050053,"H.G.Pant District Female Hospital, Pithoragarh"
1279,5,Uttarakhand,91050003,"L S  N S Bhandari Smarak, District Hospital, Gopeswhar, Chamoli"
1280,5,Uttarakhand,91050055,"Victor Mohan Joshi Female Hospital, Almora"
1281,5,Uttarakhand,91050058,"Govardhan Tiwari Base Hospital,  Almora"
1282,5,Uttarakhand,91050051,"St. Marys Hospital, Mussoorie, Dehradun"
1283,5,Uttarakhand,91050164,Cantt Board Dispensary Almora Cantt
1284,5,Uttarakhand,91050041,"SPS Government Hospital, Rishikesh"
1285,5,Uttarakhand,91050061,"District Women Hospital, Pauri Garhwal"
1286,5,Uttarakhand,91050023,"Combined Hospital, Ramnagar, Nainital"
1287,5,Uttarakhand,91050086,"CHC, Gairsain, Chamoli
"
1288,5,Uttarakhand,91050155,Cantonment General Hospital Dehradun
1289,5,Uttarakhand,91050047,"CHC, Lohaghat, Champawat"
1290,5,Uttarakhand,91050026,"J.N Sinha Memorial Hospital, Roorkee, Haridwar"
1291,5,Uttarakhand,91050071,"CHC, Bazpur, Udham Singh Nagar
"
1292,5,Uttarakhand,91050157,Cantonment Board Dispensary Nainital
1293,5,Uttarakhand,33001,"All India Institute of Medical Sciences,Rishikesh"
1294,5,Uttarakhand,33002,District Hospital Almora
1295,5,Uttarakhand,91050064,"Combined Hospital, Srinagar, Pauri Garhwal"
1296,5,Uttarakhand,91050080,"B D Pandey Male Hospital, Nainital
"
1297,5,Uttarakhand,91050090,District Hospital Champawat
1298,5,Uttarakhand,91050159,"Cantonment Board General Hospital, Roorkee"
1299,5,Uttarakhand,91050074,"CHC, Karanprayag, Chamoli"
1300,5,Uttarakhand,91050063,"District Hospital, Pauri Garhwal"
1301,5,Uttarakhand,91050054,"Government Female Hospital, Haldwani, Nainital"
1302,5,Uttarakhand,91050156,"Cantonment General Hospital, Clement Town"
1303,5,Uttarakhand,91050024,"District Female Hospital, Haridwar"
1304,5,Uttarakhand,91050037,"CHC, Doiwala, Dehradun"
1305,5,Uttarakhand,33006,"Pandit Deen Dayal Upadhyay(Coronation Hospital), Dehradun"
1306,5,Uttarakhand,91050030,"CHC, Vikasnagar, Dehradun"
1307,5,Uttarakhand,91050075,"CHC, Joshimath,Chamoli
"
1308,5,Uttarakhand,99900007,Freedom Fighter Autar Singh Topwal              District Hospital Baurari
1309,9,Uttar Pradesh,99597,100 Bedded Mother & Child Hospital Wing Chandauli
1310,9,Uttar Pradesh,99605,Primary Health Centre Ashnahar
1311,9,Uttar Pradesh,99607,Primary Health Centre Khairatiya
1312,9,Uttar Pradesh,99610,Community Health Centre Hargaon
1313,9,Uttar Pradesh,99413,Community Health Centre Khaga
1314,9,Uttar Pradesh,99611,Community Health Centre Sanda (Sakran)
1315,9,Uttar Pradesh,99133,Bhau Rao Devras Combined Hospital Lucknow
1316,9,Uttar Pradesh,99341,District Female Hospital Ghazipur
1317,9,Uttar Pradesh,99596,Rana Beni Madhaw Singh District Hospital Raebareli
1318,9,Uttar Pradesh,99296,District Combined Hospital Sant Kabir Nagar
1319,9,Uttar Pradesh,99192,District Combined Hospital Shrawasti
1320,9,Uttar Pradesh,99269,Community Health Centre Baghpat
1321,9,Uttar Pradesh,99166,Uma Shanker Dixit District Female Hospital Unnao
1322,9,Uttar Pradesh,99565,Community Health Centre Campierganj
